{
  "agent_client_id": "agent_client_001",
  "contract_version": "tbm.gate-session.v3",
  "created_at": "2026-07-27T00:00:00Z",
  "decision_id": null,
  "expires_at": "2026-07-27T01:00:00Z",
  "final_memory_revision_ids": [],
  "idempotency_key": "request-001",
  "injection_artifact_id": null,
  "lease_expires_at": "2026-07-27T00:20:00Z",
  "principal_id": "principal_001",
  "repository_id": "repository_001",
  "request_fingerprint": "sha256:aaaaaaaaaaaaaaaaaaaaaaaaaaaaaaaaaaaaaaaaaaaaaaaaaaaaaaaaaaaaaaaa",
  "retrieval_snapshot_id": "retrieval_snapshot_001",
  "run_id": "run_001",
  "run_outcome_id": null,
  "semantic_gate_attempt_ids": [],
  "session_id": "gate_session_001",
  "status": "awaiting_decision",
  "system_gate_evaluation_id": "system_gate_001",
  "tenant_id": "tenant_001",
  "terminal_reason": null,
  "trace_id": "trace_001",
  "updated_at": "2026-07-27T00:02:00Z",
  "usage_decision_id": null,
  "version": 3
}
